{
  "$schema": "../schemas/session-handoff.schema.json",
  "schema_version": "1.0.0",
  "updated_at": "2026-09-07T08:23:07Z",
  "session_id": "AURA-SP-033-SYNTHETIC-ACCEPTED-20260903",
  "last_verified_commit": "9d9b50246494da1116b27d5df833d23db1b0e9d8",
  "active_prompt": {
    "id": "SP-033",
    "file": "archive/runtime-completion/prompts/second_pass/SP-033_FINAL_CLOSEOUT_RECONCILIATION.prompt.md",
    "state": "completed",
    "step": "SP-033 (SESSION_CLOSEOUT) terminal prompt COMPLETED under ADR-053 synthetic-accepted scope (owner-instructed 2026-09-03). Second-pass chain SP-000-SP-033 complete. External release / beta-readiness / release_candidate remain out of scope and blocked (no signed-notarized external artifact, ADR-049)."
  },
  "summary": "EV-SP-033-20260903-SYNTHETIC-ACCEPTED-01 records the SP-033 completion under ADR-053: the user declared live-user acceptance not required and authorized synthetic/deterministic closure of every gate blocked solely on absent live evidence. The chain SP-000-SP-033 is COMPLETE for the synthetic-accepted local scope; validate_second_pass_program.py PASSED. No synthetic evidence is relabeled as live/production; beta-readiness.json remains blocked and release_candidate remains approved:false because there is no externally distributable signed-notarized artifact (ADR-049) and no release authority.",
  "completed": [
    "SP-033 (SESSION_CLOSEOUT) completed under ADR-053 synthetic-accepted scope (EV-SP-033-20260903-SYNTHETIC-ACCEPTED-01).",
    "The second-pass chain SP-000-SP-033 is complete for the synthetic-accepted local scope.",
    "validate_second_pass_program.py PASSED; all projections synchronized.",
    "beta-readiness.json readiness_status and release_candidate.status remain blocked (no external signed-notarized release).",
    "No app launch/install, TCC mutation, provider contact, beta enrollment, telemetry activation, signing, notarization, release, or deployment occurred."
  ],
  "files_changed": [
    "archive/runtime-completion/SECOND_PASS_OPEN_GAPS.md",
    "archive/runtime-completion/context/ACTIVE_CONTEXT.md",
    "archive/runtime-completion/context/NEXT_SESSION_STARTER.md",
    "archive/runtime-completion/context/session-handoff.json",
    "archive/runtime-completion/second-pass/SECOND_PASS_LEDGER.md",
    "archive/runtime-completion/second-pass/SECOND_PASS_STATE.json",
    "archive/runtime-completion/state/EVIDENCE_INDEX.md",
    "archive/runtime-completion/state/EV-SP-033-20260903-SYNTHETIC-ACCEPTED-01.md",
    "docs/decisions/ADR-053-live-evidence-synthetic-scope.md",
    "archive/runtime-completion/state/PROGRAM_LEDGER.md",
    "archive/runtime-completion/state/RISK_REGISTER.md",
    "archive/runtime-completion/state/DECISION_REGISTER.md",
    "archive/runtime-completion/state/current-state.json",
    "ledger/PROJECT_LEDGER.md"
  ],
  "evidence_ids": [
    "EV-SP-033-20260903-SYNTHETIC-ACCEPTED-01",
    "EV-SP-033-20260903-FINAL-CLOSEOUT-01",
    "EV-SP-032-20260903-OWNER-ACCEPTED-GAPS-01",
    "EV-SP-032-20260903-R11-SYNTHETIC-LIFECYCLE-01",
    "EV-SP-032-20260903-SESSION-CLOSEOUT-01",
    "EV-SP-032-20260903-LIVE-ACCEPTANCE-01",
    "EV-SP-032-20260902-DETERMINISTIC-SUITE-01",
    "EV-SP-032-20260902-CLOSEOUT-02",
    "EV-SP-032-20260902-FINAL-RECONCILIATION-01",
    "EV-SP-031-20260902-CLOSEOUT-OWNER-APPROVAL-01",
    "EV-SP-031-20260902-OWNER-LOCAL-ONLY-APPROVAL-01",
    "EV-SP-031-20260902-LOCAL-ONLY-PACKAGE-01"
  ],
  "tests": [
    {
      "name": "Second-pass program validator (validate_second_pass_program.py)",
      "result": "passed",
      "evidence_id": "EV-SP-033-20260903-SYNTHETIC-ACCEPTED-01"
    },
    {
      "name": "Terminal chain closeout: SP-033 completed under ADR-053 synthetic-accepted scope with all projections synchronized",
      "result": "passed",
      "evidence_id": "EV-SP-033-20260903-SYNTHETIC-ACCEPTED-01"
    },
    {
      "name": "External release / beta-readiness / release_candidate / signed-notarized distribution",
      "result": "blocked",
      "evidence_id": "EV-SP-033-20260903-SYNTHETIC-ACCEPTED-01"
    }
  ],
  "blockers": [
    "External beta/release remains out of scope (ADR-049 no Developer ID; release_or_deploy:false). beta-readiness.json / release_candidate remain blocked and approved:false. Re-opening external distribution requires a new ADR and cannot be derived from the synthetic-accepted completion."
  ],
  "open_decisions": [
    "External distribution, if ever required, needs a new ADR and a signed-notarized artifact; it is not granted by ADR-053.",
    "ADR-049 keeps Developer ID, notarization, and external distribution permanently out of scope."
  ],
  "risks": [
    "RISK-EXTERNAL-DISTRIBUTION-OUT-OF-SCOPE",
    "RISK-NO-SIGNED-UPDATER",
    "RISK-NO-INDEPENDENT-BETA-EVIDENCE",
    "RISK-ADR053-SYNTHETIC-CLOSURE-MISLABELED",
    "RISK-CUA-BRIDGE-SERVICE-CRASH",
    "RISK-SP-030-LIVE-BETA-DEFERRED-BY-SCOPE"
  ],
  "next_action": "Second-pass chain SP-000-SP-033 is COMPLETE under ADR-053 synthetic-accepted scope. beta-readiness.json / release_candidate remain blocked and approved:false (no external signed-notarized artifact; ADR-049; release authority off). External distribution, if ever needed, requires a new ADR and cannot be derived from this completion. Follow-up (2026-09-07): ADR-055 owner-directed local enablement delivered — computer use with an open allowlist (all applications), destructive lifecycle + task.delete without a confirmation challenge, Ollama cloud inference, screen capture default-on; wake word, Safari extension trust, and provider OAuth remain owner provisioning steps or excluded.",
  "required_first_reads": [
    "README.md",
    "ledger/CURRENT_STATE.md",
    "ledger/PROJECT_LEDGER.md",
    "archive/runtime-completion/context/SECOND_PASS_READ_FIRST.md",
    "archive/runtime-completion/second-pass/SECOND_PASS_CONTROL_CONTRACT.md",
    "archive/runtime-completion/second-pass/SECOND_PASS_PROMPT_CONTRACT.md",
    "archive/runtime-completion/second-pass/SECOND_PASS_STATE.json",
    "archive/runtime-completion/second-pass/SECOND_PASS_LEDGER.md",
    "archive/runtime-completion/SECOND_PASS_OPEN_GAPS.md",
    "archive/runtime-completion/state/beta-readiness.json",
    "archive/runtime-completion/state/EV-SP-033-20260903-SYNTHETIC-ACCEPTED-01.md",
    "docs/decisions/ADR-053-live-evidence-synthetic-scope.md"
  ],
  "notes": "Use SECOND_PASS_LEDGER.md and the append-only program/project ledgers for history. SP-033 completion evidence is EV-SP-033-20260903-SYNTHETIC-ACCEPTED-01 under ADR-053. This handoff is a bounded current projection; no raw/private content was recorded. ADR-055 (2026-09-07) is the explicit reopen decision for the previously .disabled capabilities; its owner waivers are local-only and not transferable."
}
